Total Citation,No Citations,paper file name,author,subject,createdDate
"31","2","DAC-2004-10(06)-0524.PDF","Pankaj Chauhan, Edmund M. Clarke, Daniel Kroening","A SAT-Based Algorithm for Reparameterization in Symbolic Simulation","2004"
"159","12","DAC-2004-10(06)-0530.PDF","Paul T. Darga, Mark H. Liffiton, Karem A. Sakallah, and Igor L. Markov","Exploiting Structure in Symmetry Detection for CNF","2004"
"24","1","DAC-2004-10(06)-0535.PDF","Chao Wang, HoonSang Jin, Gary D. Hachtel, Fabio Somenzi","Refining the SAT Decision Ordering for Bounded Model Checking","2004"
"7","0","DAC-2004-10(06)-0539.PDF","Demosthenes Anastasakis, Lisa McIlwain, Slawomir Pilarski","Efficient Equivalence Checking with Partitions and Hierarchical Cut-points","2004"
"24","1","DAC-2004-10(06)-0472.PDF","Bin Wu, Jianwen Zhu, Farid N. Najm","An Analytical Approach for Dynamic Range Estimation","2004"
